{
  "artifact_dir": "tests/fixtures/runs/all_suppressed",
  "artifact_paths": {
    "summary": "summary.json"
  },
  "base": "main",
  "cli_version": "0.3.0",
  "command_line": null,
  "duration_seconds": 2.0,
  "finished_at": "2026-05-13T00:00:02Z",
  "final_status": "clear",
  "harness": "fake",
  "harness_version": null,
  "iterations": [
    {
      "iteration": 1,
      "review_status": "findings"
    }
  ],
  "max_iterations": 1,
  "phases": {
    "triage": {
      "count": 1
    }
  },
  "profile": null,
  "run_id": "fixture-suppressed",
  "schema_version": "1.0",
  "started_at": "2026-05-13T00:00:00Z",
  "stopped_reason": "all_findings_suppressed",
  "tokens": null,
  "usd": null
}
