{
  "artifact_dir": "tests/fixtures/runs/findings_remaining",
  "artifact_paths": {
    "reviews": [
      "review-1.txt"
    ],
    "summary": "summary.json",
    "triage": [
      "triage-1.json"
    ]
  },
  "base": "main",
  "cli_version": "0.3.0",
  "command_line": null,
  "duration_seconds": 2.0,
  "finished_at": "2026-05-13T00:00:02Z",
  "final_status": "findings",
  "harness": "fake",
  "harness_version": null,
  "iterations": [
    {
      "iteration": 1,
      "review_status": "findings"
    }
  ],
  "max_iterations": 1,
  "phases": {
    "review": {
      "count": 1
    }
  },
  "profile": null,
  "run_id": "fixture-findings-remaining",
  "schema_version": "1.0",
  "started_at": "2026-05-13T00:00:00Z",
  "stopped_reason": "max_iterations_reached",
  "tokens": null,
  "usd": null
}
