{
  "artifact_dir": "tests/fixtures/runs/findings_remediated",
  "artifact_paths": {
    "reviews": [
      "review-1.txt"
    ],
    "summary": "summary.json"
  },
  "base": "main",
  "cli_version": "0.3.0",
  "command_line": null,
  "duration_seconds": 6.0,
  "finished_at": "2026-05-13T00:00:06Z",
  "final_status": "clear",
  "harness": "fake",
  "harness_version": null,
  "iterations": [
    {
      "check_passes": 1,
      "iteration": 1,
      "review_status": "findings"
    }
  ],
  "max_iterations": 1,
  "phases": {
    "check": {
      "count": 1
    },
    "remediate": {
      "count": 1
    },
    "review": {
      "count": 2
    }
  },
  "profile": null,
  "run_id": "fixture-findings-fixed",
  "schema_version": "1.0",
  "started_at": "2026-05-13T00:00:00Z",
  "stopped_reason": "review_clear",
  "tokens": null,
  "usd": null
}
